{
  "chainlist": {
    "commit": "cdb07325333894f6fee154ce393649d47de2c09b",
    "repository": "ethereum-lists/chains"
  },
  "entities": [
    {
      "addresses": [
        {
          "address": "0xC1b634853Cb333D3aD8663715b08f41A3Aec47cc",
          "confidence": "confirmed",
          "evidence": [
            {
              "type": "documentation",
              "url": "https://docs.arbitrum.io/build-decentralized-apps/reference/contract-addresses"
            },
            {
              "type": "verified_contract",
              "url": "https://etherscan.io/address/0x1c479675ad559DC151F6Ec7ed3FbF8ceE79582B6#readProxyContract"
            },
            {
              "type": "dashboard",
              "url": "https://blobscan.com/tx/0x5969e9d520e138e6eeb5c020a75635fd2fdc15803f707dce7909c1bf062b32d0"
            },
            {
              "type": "analysis",
              "url": "https://etherscan.io/address/0xc1b634853cb333d3ad8663715b08f41a3aec47cc"
            },
            {
              "submission_chain": "eip155-1",
              "tx_hash": "0x5969e9d520e138e6eeb5c020a75635fd2fdc15803f707dce7909c1bf062b32d0",
              "type": "transaction"
            }
          ],
          "label": "Arbitrum One batch poster",
          "role": "batcher",
          "status": "active",
          "submission_chain": "eip155-1",
          "valid_from": {
            "block": 19433943
          },
          "valid_to": null
        }
      ],
      "category": "rollup",
      "chain_refs": [
        {
          "caip2": "eip155-42161",
          "relationship": "canonical_chain"
        },
        {
          "caip2": "eip155-1",
          "relationship": "settlement_chain"
        }
      ],
      "description": "Optimistic rollup developed by Offchain Labs.",
      "icon": {
        "chain_ref": "eip155-42161",
        "mode": "chainlist"
      },
      "id": "arbitrum",
      "name": "Arbitrum One",
      "schema_version": 1,
      "status": "active",
      "website": "https://arbitrum.io"
    },
    {
      "addresses": [
        {
          "address": "0x5050F69a9786F081509234F1a7F4684b5E5b76C9",
          "confidence": "confirmed",
          "evidence": [
            {
              "type": "documentation",
              "url": "https://docs.base.org/base-chain/network-information/base-contracts"
            },
            {
              "submission_chain": "eip155-1",
              "tx_hash": "0x829b6505c53658ed1923811105ec27724acd5bf673f54fcde03c294b30479222",
              "type": "transaction"
            }
          ],
          "label": "Base batch sender",
          "role": "batcher",
          "status": "active",
          "submission_chain": "eip155-1",
          "valid_from": {
            "block": 19429647
          },
          "valid_to": null
        }
      ],
      "category": "rollup",
      "chain_refs": [
        {
          "caip2": "eip155-8453",
          "relationship": "canonical_chain"
        },
        {
          "caip2": "eip155-1",
          "relationship": "settlement_chain"
        }
      ],
      "description": "Ethereum L2 incubated by Coinbase.",
      "icon": {
        "chain_ref": "eip155-8453",
        "mode": "chainlist"
      },
      "id": "base",
      "name": "Base",
      "schema_version": 1,
      "status": "active",
      "website": "https://base.org"
    },
    {
      "addresses": [
        {
          "address": "0x6887246668a3b87F54DeB3b94Ba47a6f63F32985",
          "confidence": "confirmed",
          "evidence": [
            {
              "type": "repository",
              "url": "https://github.com/ethereum-optimism/superchain-registry/blob/main/superchain/configs/mainnet/op.toml"
            },
            {
              "submission_chain": "eip155-1",
              "tx_hash": "0xa3e36193ab5ca4e6e98848640b1896def4c419ce203e7bd8e876dd2d5eb77e6c",
              "type": "transaction"
            }
          ],
          "label": "OP Mainnet batcher",
          "role": "batcher",
          "status": "active",
          "submission_chain": "eip155-1",
          "valid_from": {
            "block": 19429617
          },
          "valid_to": null
        }
      ],
      "category": "rollup",
      "chain_refs": [
        {
          "caip2": "eip155-10",
          "relationship": "canonical_chain"
        },
        {
          "caip2": "eip155-1",
          "relationship": "settlement_chain"
        }
      ],
      "description": "Optimistic rollup built on the OP Stack and governed by the Optimism Collective.",
      "icon": {
        "chain_ref": "eip155-10",
        "mode": "chainlist"
      },
      "id": "optimism",
      "name": "OP Mainnet",
      "schema_version": 1,
      "status": "active",
      "website": "https://www.optimism.io"
    },
    {
      "addresses": [
        {
          "address": "0x054a47B9E2a22aF6c0CE55020238C8FEcd7d334B",
          "confidence": "probable",
          "evidence": [
            {
              "type": "dashboard",
              "url": "https://blobscan.com/tx/0x4833959a8d331c8f027583185ab9fe88971422b3dcda9cf83a800f1f02833792"
            },
            {
              "type": "analysis",
              "url": "https://etherscan.io/address/0x054a47b9e2a22af6c0ce55020238c8fecd7d334b"
            },
            {
              "submission_chain": "eip155-1",
              "tx_hash": "0x4833959a8d331c8f027583185ab9fe88971422b3dcda9cf83a800f1f02833792",
              "type": "transaction"
            }
          ],
          "label": "Scroll batch committer",
          "role": "batcher",
          "status": "active",
          "submission_chain": "eip155-1",
          "valid_from": {
            "block": 21464803
          },
          "valid_to": null
        }
      ],
      "category": "rollup",
      "chain_refs": [
        {
          "caip2": "eip155-534352",
          "relationship": "canonical_chain"
        },
        {
          "caip2": "eip155-1",
          "relationship": "settlement_chain"
        }
      ],
      "description": "Ethereum zkEVM rollup.",
      "icon": {
        "chain_ref": "eip155-534352",
        "mode": "chainlist"
      },
      "id": "scroll",
      "name": "Scroll",
      "schema_version": 1,
      "status": "active",
      "website": "https://scroll.io"
    }
  ],
  "generated_at": "2026-05-24T18:45:18.576Z",
  "schema_version": 1
}
